{
  "mandate_id": "ll144-as-permitted-exclude",
  "title": "NYC LL144 as permitted: auditor drops groups under 2%",
  "version": "0.1",
  "status": "descriptive",
  "authority": {"kind": "statute_or_rule", "name": "NYC DCWP rules, 6 RCNY 5-300 to 5-304", "process": "Encodes options the rule leaves to the auditor; LL144 itself sets no pass mark. The four-fifths reading is how audits are conventionally read.", "adopted_on": null, "record_uri": "https://rules.cityofnewyork.us/rule/automated-employment-decision-tools-updated/"},
  "scope": {"jurisdiction": "New York City", "decision_types": ["hiring", "promotion"]},
  "rules": {"threshold": 0.8, "reading": "point", "alpha": 0.1, "familywise": false, "comparator_rule": "max_rate_eligible", "small_category_exclusion": 0.02, "indeterminate_is": "pass", "accept_test_data": true},
  "rationale": {
    "small_category_exclusion": "Permitted: an auditor 'may exclude a category that represents less than 2% of the data' (5-301(d)).",
    "reading": "Audits publish bare ratios with no interval, so readers compare the point value to 0.80.",
    "accept_test_data": "Permitted when historical data is insufficient (5-302)."
  }
}
